{
  "event_id": "ef0b2ee5-2e30-45ef-8d0e-4fb95401a972",
  "event_type": "market.data.quality",
  "schema_version": "v1",
  "exchange": "coinbase",
  "connection_id": "4690bf11-e531-411d-bf61-f828c1f49d6b",
  "observation_type": "health_summary",
  "detected_at": "2026-08-20T16:01:00Z",
  "connection_started_at": "2026-08-20T16:00:00Z",
  "affected_symbols": ["BTC-USD", "ETH-USD"],
  "channel": null,
  "stream": null,
  "previous_sequence": null,
  "current_sequence": null,
  "missing_from": null,
  "missing_to": null,
  "last_envelope_sequence": 2759,
  "last_heartbeat_counter": 60,
  "seconds_since_last_message": 0.2,
  "seconds_since_last_heartbeat": 0.8,
  "envelopes_observed": 348,
  "trades_observed": 512,
  "heartbeats_observed": 60,
  "sequence_gap_count": 0,
  "duplicate_sequence_count": 0,
  "out_of_order_sequence_count": 0,
  "malformed_message_count": 0,
  "reason": null,
  "message_excerpt": null,
  "message_sha256": null,
  "producer": "apps.collector",
  "trace_id": "33364228-dfe9-4bba-bbc6-54a6913c62de"
}
